{
  "$schema": "../json-schema/energy-utilities-energy-data-point-schema.json",
  "series": "eia.electricity.rto.region-data.H.NYIS.D",
  "timestamp": "2026-05-22T18:00:00Z",
  "intervalSeconds": 3600,
  "value": 18742,
  "unit": "MW",
  "kind": "load",
  "location": {
    "balancingAuthority": "NYIS"
  },
  "asset": {
    "type": "balancing-authority"
  },
  "quality": "preliminary",
  "source": {
    "providerId": "eia",
    "endpoint": "/v2/electricity/rto/region-data/data/",
    "retrievedAt": "2026-05-22T19:10:00Z"
  },
  "tags": ["hourly-demand", "balancing-authority"]
}
